{"scenario_id":"CRT-001","bounded_runtime_sequence":["UI producer invokes a platform function across a same-process ABI / FFI boundary.","The local asynchronous operation completes and hands the result back to the UI thread.","The state owner persists the result to one durable store.","A later consumer in another process observes the persisted state."],"execution_models":["Same-process ABI / FFI boundary","Local asynchronous operation / UI-thread handoff","Cross-process durable-state observation"],"recommended_profile":"standard-slice","required_sections":{"bounded_runtime_sequence":true,"execution_model_classification":true,"risk_semantics":true,"why_standard_slice_is_insufficient":true,"recommendation_confidence":true,"profile_change_evidence":true},"candidate_bounded_sequence":"UI producer → same-process ABI / FFI → local asynchronous completion and UI-thread handoff → state owner → one durable store → later cross-process reader","independent_implementation_slices_required":[],"shared_semantics_that_must_remain_fixed":["durable state の書き込み authority は state owner にある","later cross-process reader は永続化済み state を観測する","startup wiring は producer、state owner、reader を production entrypoint に接続する"],"why_one_bounded_parent_pass_is_insufficient":"不十分とは確認できない。ABI / FFI、UI-thread handoff、durable write、later cross-process read は一つの順序付けられた runtime sequence として実装・検証できる。","failure_mode_that_decomposition_prevents":"該当なし。分割すると、durable write と later reader の production wiring を一つの end-to-end verification surface で確認しにくくなる可能性がある。","escalation_gate_result":"NotSatisfied","recommendation_confidence":"High","evidence_that_would_lower_the_profile":"later reader が別 process ではない、durable store を介さない、または production wiring の変更が不要であることを示す evidence。","evidence_that_would_raise_the_profile":"独立した複数の runtime sequence が必要で、authority、ordering、identity、schema、rollback、または forbidden state を共有し、単一の bounded parent pass では安全に実装・検証できないことを示す evidence。"}
