{"scenario_id":"CRT-003","bounded_runtime_sequence":["Producer recovery → durable identity（correlation_id + generation）の維持 → atomic durable publication","Consumer startup → published generation の identity validation → read-only replay"],"execution_models":["Cross-process durable-state observation","Independent background worker","Persistent queue / replayable job"],"recommended_profile":"full-coverage","required_sections":{"bounded_runtime_sequence":true,"execution_model_classification":true,"risk_semantics":true,"why_standard_slice_is_insufficient":true,"recommendation_confidence":true,"profile_change_evidence":true},"candidate_bounded_sequence":"producer recovery / publish と consumer startup / replay を、共有 durable identity と protocol を含む単一 parent pass として実装・検証する。","independent_implementation_slices_required":["producer recovery and atomic durable publication","consumer startup, identity validation, and replay"],"shared_semantics_that_must_remain_fixed":["durable identity は correlation_id と generation の組である","producer が唯一の state authority であり、consumer は read-only である","consumer は完全に publish 済みで identity が一致する generation のみ受理できる"],"why_one_bounded_parent_pass_is_insufficient":"2つの sequence は owner、entrypoint、retry lifecycle、verification surface が独立している一方、同一の durable identity と producer-consumer protocol を維持する必要がある。単一 pass では独立した recovery failure と protocol compatibility の検証境界が曖昧になる。","failure_mode_that_decomposition_prevents":"producer recovery 後、slice 間で identity または atomic publication protocol が不整合になり、consumer が stale generation または partially published generation を受理する失敗を防ぐ。","escalation_gate_result":"Satisfied","recommendation_confidence":"High","evidence_that_would_lower_the_profile":"両 sequence が実際には同一 owner、entrypoint、retry lifecycle、verification oracle を持ち、atomic publication から replay までを一つの bounded pass で安全に実装・検証できる証拠。","evidence_that_would_raise_the_profile":"追加の独立 sequence、競合する state authority、または未確定の cross-slice identity / temporal protocol が判明すれば、full-coverage 内で Architecture Elaboration の必要性が高まる。"}
