{"scenario_id":"CRT-003","bounded_runtime_sequence":["Producer の background recovery loop が crash/retry 後に durable journal から generation を再構築し、cross-run correlation identifier を維持する","Producer が sole state authority として完全な generation を atomic publish する","Consumer の独立した startup/replay loop が producer を呼び出さず、公開済み generation を cross-process に観測する","Consumer が correlation identifier と generation の組を検証し、完全に publish された一致 generation のみを replay する"],"execution_models":["Cross-process durable-state observation","External or independently deployed service","Independent background worker","Persistent queue / replayable job"],"recommended_profile":"full-coverage","required_sections":{"bounded_runtime_sequence":true,"execution_model_classification":true,"risk_semantics":true,"why_standard_slice_is_insufficient":true,"recommendation_confidence":true,"profile_change_evidence":true},"candidate_bounded_sequence":"Producer recovery: durable journal から generation を再構築して atomic publish → Consumer startup/replay: publish 済み generation を読み、correlation identifier と generation を検証して replayする、という単一の end-to-end sequence。","independent_implementation_slices_required":["Producer-owned slice: background recovery loop、durable journal reconstruction、cross-run identity preservation、atomic publication、producer entrypoint/retry lifecycle/recovery verifier","Consumer-owned slice: independent startup/replay loop、published-generation observation、identity validation、complete matching generation のみの replay、consumer entrypoint/retry lifecycle/replay verifier"],"shared_semantics_that_must_remain_fixed":["Producer が sole state authority であり、Consumer は read-only であること","Durable identity が correlation identifier と generation の組であること","Generation publication が atomic かつ complete であること","Stale generation または partially published generation の受理が forbidden state であること"],"why_one_bounded_parent_pass_is_insufficient":"Candidate sequenceは end-to-end behavior を表せるが、Producer と Consumer はそれぞれ独立した release unit、entrypoint、retry lifecycle、verifier を持ち、独立に実装・検証できる別 runtime sequenceである。単一 pass にまとめると、各 component 固有の recovery/replay lifecycle と production wiring の検証境界が曖昧になり、共有 identity・publication protocol の cross-slice invariant を独立リリース間で固定したまま検証できない。","failure_mode_that_decomposition_prevents":"Producer と Consumer が各自の verifier では成功していても、一方だけが correlation identifier＋generation の解釈または atomic publication protocol を変更し、Consumer recovery が stale、partially published、または別 correlation の generation を有効として受理する failure を防ぐ。","escalation_gate_result":"Satisfied","recommendation_confidence":"High","evidence_that_would_lower_the_profile":"両 component が実際には同一 release unit・同一 entrypoint・同一 retry lifecycle・単一の production verifier で変更され、共有 protocol を一つの bounded implementation/verification passで atomic に更新できる証拠、または変更が片側だけで既存 protocol を変更しない証拠。","evidence_that_would_raise_the_profile":"利用可能な profile では full-coverage が上限。追加の state authority、schema migration、複数 consumer、非互換 rollout ordering、cleanup/rollback protocol が判明すれば、profile自体は変わらないが architecture-readiness と cross-slice verification の対象を拡大する。"}
