{"scenario_id":"CRT-002","bounded_runtime_sequence":["Producer が cross-process message を発行する","durable state へ atomic publish する","別 process が durable state を観測する","失敗時に同一 publish sequence を replay / retry する","production wiring と fake wiring、および installer rollback を同じ parent verification pass で検証する"],"execution_models":["Cross-process IPC","Cross-process durable-state observation","Persistent queue / replayable job"],"recommended_profile":"standard-slice","required_sections":{"bounded_runtime_sequence":true,"execution_model_classification":true,"risk_semantics":true,"why_standard_slice_is_insufficient":true,"recommendation_confidence":true,"profile_change_evidence":true},"candidate_bounded_sequence":"message producer → cross-process IPC → durable state の atomic publish → later cross-process observation → replay / retry → production/fake wiring と installer rollback の検証","independent_implementation_slices_required":[],"shared_semantics_that_must_remain_fixed":["durable state の ownership","atomic publish の可視性境界","replay / retry / idempotency semantics","production implementation と test fake の対応","startup / installer wiring と rollback semantics"],"why_one_bounded_parent_pass_is_insufficient":"不十分とは立証されていない。すべての risk semantics は一つの atomic publish sequence に収束し、authority、ordering、production wiring、rollback、test oracle を一つの bounded parent pass で実装・検証できる。","failure_mode_that_decomposition_prevents":"該当なし。decomposition が防ぐ固有の failure mode は示されておらず、分割すると atomic publish、replay、wiring、rollback の一体的な検証を弱める可能性がある。","escalation_gate_result":"NotSatisfied","recommendation_confidence":"High","evidence_that_would_lower_the_profile":"IPC、durable publication、replay、installer rollback、production/fake wiring が同一 entrypoint と同一 verification oracle によりさらに局所化され、runtime contract も既存証拠で固定済みと確認できれば contract-kernel を検討できる。","evidence_that_would_raise_the_profile":"producer publication と consumer replay が独立した owner、entrypoint、retry lifecycle、verification surface を持ち、共有 identity・schema・authority・forbidden state を個別 slice 間で固定する必要があり、単一 parent pass では安全に検証できないことが source-backed で示されれば full-coverage に上げる。"}
