{"scenario_id":"CRT-001","bounded_runtime_sequence":["デスクトッププロセスの既存 entrypoint が production stub の代わりに in-process native interop wrapper を呼び出す","native interop wrapper が operating-system API を同一プロセス内で呼び出す","完了 callback がアプリケーションの UI thread に marshal される","同じアプリケーション component が既存の operation identifier と record schema を維持して durable local store に operation record を書き込む","別途起動された status process が startup 時に durable local store を read-only で開き、完了した operation を表示する","platform call から後発 reader の表示までを end-to-end check で検証する"],"execution_models":["Same-process ABI / FFI boundary","Cross-process durable-state observation","Local asynchronous operation / UI-thread handoff"],"recommended_profile":"standard-slice","required_sections":{"bounded_runtime_sequence":true,"execution_model_classification":true,"risk_semantics":true,"why_standard_slice_is_insufficient":true,"recommendation_confidence":true,"profile_change_evidence":true},"candidate_bounded_sequence":"既存 entrypoint の production binding → 同一プロセスの OS API 呼び出し → UI-thread callback → 単一 writer による durable record 保存 → status process の startup read-only observation → end-to-end verification を一つの bounded pass として扱う。External service、独立 worker、replay queue は含まれない。","independent_implementation_slices_required":[],"shared_semantics_that_must_remain_fixed":["既存の operation identifier","既存の operation record schema","アプリケーション component が durable local store の唯一の writer であること","status process が startup 時に store を read-only で観測すること","production entrypoint が stub ではなく native interop wrapper に binding されること"],"why_one_bounded_parent_pass_is_insufficient":"不十分ではない。ABI/FFI、UI-thread handoff、durable-state の cross-process observation、production stub の置換という複数の risk semantics は、順序、authority、production wiring、test oracle が明確な単一の runtime sequence に収束している。","failure_mode_that_decomposition_prevents":"該当なし。分割すると、production binding、record 書き込み、後発 reader の表示を結ぶ end-to-end contract の検証が断片化する可能性があり、この変更事実からは分割によって防止される固有の failure mode を示せない。","escalation_gate_result":"NotSatisfied","recommendation_confidence":"High","evidence_that_would_lower_the_profile":"native interop contract、production entrypoint binding、UI-thread marshal、既存 schema を使う writer-reader compatibility が既存の production-backed evidence ですでに確認済みで、今回が狭い binding 差し替えだけだと示されれば contract-kernel または lightweight を検討できる。","evidence_that_would_raise_the_profile":"別の独立 runtime sequence、複数 writer または authority 競合、identifier/schema migration、retry・resume・replay、独立 worker、persistent queue、independently deployed service、あるいは単一 pass では ordering と verification oracle を維持できない source-backed evidence が見つかれば full-coverage を検討する。"}
