{"scenario_id":"CRT-003","bounded_runtime_sequence":["Producer recovery → durable identity（correlation_id + generation）の維持 → atomic durable publication","Consumer startup → published generationのidentity検証 → read-only replay"],"execution_models":["Cross-process durable-state observation","Independent background worker","Persistent queue / replayable job"],"recommended_profile":"full-coverage","required_sections":{"bounded_runtime_sequence":true,"execution_model_classification":true,"risk_semantics":true,"why_standard_slice_is_insufficient":true,"recommendation_confidence":true,"profile_change_evidence":true},"candidate_bounded_sequence":"1つのparent passでproducer recovery/publicationとconsumer startup/replayを連結して実装・検証する。","independent_implementation_slices_required":["producer recovery and atomic durable publication","consumer startup, identity validation, and replay"],"shared_semantics_that_must_remain_fixed":["durable identityはcorrelation_idとgenerationの組である","producerが唯一のstate authorityであり、consumerはread-onlyである","consumerが受理できるのは完全にpublishされ、identityが一致するgenerationだけである"],"why_one_bounded_parent_pass_is_insufficient":"2つのsequenceはowner、entrypoint、retry lifecycle、verification surfaceが独立している一方、同一のdurable identity、state authority、producer-consumer protocol、stale-generation禁止条件を維持する必要がある。単一passでは独立したfailure recoveryと共有protocolの検証責務が曖昧になるため、standard-sliceでは不十分となる。","failure_mode_that_decomposition_prevents":"producer recovery後、いずれかのsliceがidentityまたはpublication protocolを独立に変えた結果、consumerがstale generationまたは部分的にpublishされたgenerationを受理する失敗。","escalation_gate_result":"Satisfied","recommendation_confidence":"High","evidence_that_would_lower_the_profile":"両sequenceが実際には同一owner、entrypoint、retry lifecycle、verification oracleを持ち、atomic publicationからconsumer replayまでを1つのbounded passで安全に実装・検証できるというsource-backed evidence。","evidence_that_would_raise_the_profile":"追加の独立sequence、競合するstate authority、またはcross-slice identity／ordering／rollback semanticsが存在し、architecture-readinessでさらに強い相互接続が確認される証拠。"}
