{"scenario_id":"CRT-002","bounded_runtime_sequence":["インストーラーが一意な request identifier を含む publish request を local broker process へ送信する。","broker が message を検証し、同じ identifier の concurrent request を broker-owned publication transaction で直列化する。","broker が versioned record を stage し、current durable record を atomically replace する。","broker が request identifier と publication outcome を記録して acknowledgement を返す。","acknowledgement 喪失時、インストーラーが同じ identifier で再試行し、broker が記録済み outcome を replay して二重 publish を防ぐ。","rollback も同じ request、transaction、durable publication、acknowledgement lifecycle を使って prior version を復元する。","production transport と fake transport は異なる registration から同じ broker handler に入り、同じ publication oracle で end-to-end verification される。"],"execution_models":["Cross-process IPC"],"recommended_profile":"standard-slice","required_sections":{"bounded_runtime_sequence":true,"execution_model_classification":true,"risk_semantics":true,"why_standard_slice_is_insufficient":true,"recommendation_confidence":true,"profile_change_evidence":true},"candidate_bounded_sequence":"installer wiring → cross-process publish request → broker validation and identifier-based serialization → version staging → atomic durable-record replacement → recorded outcome and acknowledgement → same-identifier retry replay、ならびに同一 lifecycle による rollback を、production/fake registration と共通 handler/oracle の end-to-end verification まで一つの bounded pass で扱う。","independent_implementation_slices_required":[],"shared_semantics_that_must_remain_fixed":["request identifier に基づく idempotency と recorded outcome replay","broker-owned publication transaction による同一 identifier の直列化","versioned record の staging と current durable record の atomic replacement","rollback が通常 publish と同じ request/publication lifecycle を使うこと","production transport と fake transport が同じ broker handler と publication oracle に収束すること"],"why_one_bounded_parent_pass_is_insufficient":"不十分ではない。installer、broker、durable publication transaction、retry/replay、rollback、production/fake wiring、end-to-end oracle は一つの明確な runtime sequence に収束し、broker が authority、ordering、atomicity、idempotency を一貫して所有している。","failure_mode_that_decomposition_prevents":"根拠のある decomposition 対象はない。むしろ分割すると、transport wiring、broker transaction、retry replay、rollback、publication oracle の整合性を別々に検証してしまい、個別には成功しても接続時に二重 publish、誤った outcome replay、または fake-only success を見逃すおそれがある。","escalation_gate_result":"NotSatisfied","recommendation_confidence":"High","evidence_that_would_lower_the_profile":"publish transport が実際には cross-process boundary ではなく、production/fake registration の差もなく、durable replacement・retry replay・rollback を既存の不変 contract として変更しない証拠があれば、より軽い profile を検討できる。","evidence_that_would_raise_the_profile":"broker 以外が durable state authority を共有する、独立した consumer protocolまたは release unit が存在する、publish と rollback が異なる lifecycle を持つ、複数の独立 runtime sequence 間で identity・ordering・schema・rollback semantics を固定する必要がある、あるいは単一 pass では production wiring と end-to-end oracle を安全に検証できない証拠があれば full-coverage を検討する。"}
