{"scenario_id":"CRT-001","bounded_runtime_sequence":["デスクトップ process の既存 entrypoint が production stub の代わりに OS API を in-process native interop wrapper 経由で呼び出す","完了 callback を application の UI thread へ marshal する","同じ application component が operation identifier と record schema を維持して durable local store に operation record を書き込む","別途起動された status process が startup 時に store を read-only で開く","status process が完了した operation を表示する"],"execution_models":["Same-process ABI / FFI boundary","Local asynchronous operation / UI-thread handoff","Cross-process durable-state observation"],"recommended_profile":"standard-slice","required_sections":{"bounded_runtime_sequence":true,"execution_model_classification":true,"risk_semantics":true,"why_standard_slice_is_insufficient":true,"recommendation_confidence":true,"profile_change_evidence":true},"candidate_bounded_sequence":"既存 entrypoint の production binding → in-process OS API 呼び出し → UI-thread callback → 単一 writer による durable record 保存 → status process の startup 時 read-only observation → 表示、を既存 identifier/schema と一つの end-to-end oracle で検証する単一 sequence。","independent_implementation_slices_required":[],"shared_semantics_that_must_remain_fixed":["operation identifier の継続性","durable operation record の既存 schema","application component が唯一の writer であること","status process が startup 時に read-only consumer として観測すること","production entrypoint が stub ではなく native interop implementation に binding されること"],"why_one_bounded_parent_pass_is_insufficient":"不十分ではない。ABI/FFI、UI-thread handoff、durable-state observation、production binding はすべて一つの順序付けられた runtime sequence に収束し、単一の end-to-end check で production wiring と later reader の観測結果を結び付けられる。","failure_mode_that_decomposition_prevents":"この evidence では decomposition によって追加で防げる具体的 failure mode は示されていない。むしろ分割すると、producer 側だけが成功して reader 側との identifier/schema または production wiring の不一致を見落とすおそれがある。","escalation_gate_result":"NotSatisfied","recommendation_confidence":"High","evidence_that_would_lower_the_profile":"status process が同一 process 内の consumer に変更され、durable cross-process observation と production stub replacement が不要で、既存 binding の局所的変更だけで完結する証拠。","evidence_that_would_raise_the_profile":"独立した runtime sequence が追加され、複数 writer、競合する state authority、schema migration、retry/replay、background worker、persistent queue、または単一 pass では維持できない cross-slice invariant が存在する証拠。"}
